{
  "naics": "541890",
  "title": "Other Services Related to Advertising",
  "run_meta": {
    "model_id": "gpt-5.6-terra",
    "run_date": "2026-07-21",
    "run_id": "2026-07-21_gpt-5.6-terra_v312f1_541890",
    "template_version": "3.1.2",
    "prompt_version": "v3.1.2-text-first-1",
    "attempt": 1,
    "finalizer_version": "finalizer-3.1.2",
    "memo_renderer_version": "memo-renderer-3.1.2"
  },
  "narrative": {
    "executive_view": "This is a heterogeneous catch-all, but promotional-products distribution is the best-supported working dominant subsegment: Census product detail explicitly includes coordinating logoed advertising-specialty production and delivery [S2], while ASI reports a $26.6bn promo industry [S3]. A $1–10m EBITDA target can harvest meaningful quoting, artwork and order-administration savings, but it is not a clean software-like roll-up: supplier-side revenue is in the trade total, client books can be portable, and physical/event-service work is not replaced. I therefore view the code as a conditional relationship-protected reseller opportunity, not a broad AI windfall.",
    "how_ai_changes_work": "AI primarily removes information and coordination work: product search, first-pass artwork, mockups, proof routing, quote preparation, store administration, supplier chasing and billing. ASI reports that 50% of extra-large ($5m+) distributors use AI and that creative copy is the most common use among AI users [S4], which supports rapid tool diffusion but not full task replacement at smaller firms. In-person demonstrations, sampling, installation and the physical production and delivery of merchandise remain human or supplier work; salespeople and account leaders still own the brief and relationship.",
    "value_capture": "The economic model is markup resale and managed-program service, not a billable-hour consultancy. 4imprint's 2025 results show $1.347bn revenue, $436m gross profit and $145m operating profit [S5], demonstrating that scaled direct distribution can retain healthy economics. That is a benchmark, not a comp for a small independent: online self-service makes search, artwork and ordering more contestable and is likely to pass a material part of labor savings to buyers. I set capture below one-half on both distribution and moat, because company stores and supplier access help retention but portable sales books and transparent quotes limit it.",
    "adoption_timing": "The reported 50% AI-use rate applies to extra-large distributors, not the full code or the lower-middle market [S4]. I therefore estimate current effective adoption at 35%, with roughly 2.5 years to 50% effective adoption as tools move from copy and mockups into quote-to-cash workflows. This is deliberately slower than casual AI use: integration with supplier data, approval workflows and client systems matters more than access to a general model.",
    "consolidation_economics": "There is real, current consolidation: HALO acquired What's Happening Promotions in October 2025 [S6], BDA acquired Harper + Scott in September 2025 [S7], and Overture acquired Pride Products in January 2026 [S8]. These facts support active buyers, not a claim that every small distributor is buyable or that deal terms are known. The selected 4.0x buy and 5.0x exit multiples sit inside Windsor Drake's Q1 2026 marketing/digital-agency $3m–$10m EBITDA range of 4.0x–6.5x [S9], but that is an adjacent broad category; a target with concentrated or salesperson-owned accounts warrants the low end.",
    "terminal_demand": "Demand for physical branded merchandise is more durable than the distributor's intermediation. Census describes a 541890 product as coordinating production of logoed specialties and delivering them to the client [S2], and AI cannot itself manufacture or distribute the object. The pressure is that AI-native search and self-service can reduce the value of the independent coordination layer. I classify terminal demand as PRESSURED rather than MELTING: enterprise program management, fulfillment and trusted account service can persist, but a bare-bones reseller has a credible bypass risk.",
    "risks_and_uncertainty": "The code includes merchandise coordination, demonstrations and other advertising services, so no single trade statistic maps cleanly to it. ASI's $26.6bn figure covers a broader promotional-products ecosystem [S3], and its 50% AI statistic is for extra-large distributors [S4]. The deterministic OEWS proxy is 4-digit 5418 and imports agency roles, so the role estimate is sensitive. There is no verified, code-specific owner-age survey or disclosed small-target transaction multiple in the reopened sources; those inputs are deliberately low-confidence estimates rather than invented facts."
  },
  "sources": [
    {
      "id": "S1",
      "url": "https://www.census.gov/naics/?details=541&input=541&year=2022",
      "title": "2022 NAICS definition: 541890",
      "access_date": "2026-07-21",
      "what_it_supports": "Official NAICS context: 541890 is the residual advertising-services industry after named advertising categories are excluded."
    },
    {
      "id": "S2",
      "url": "https://www2.census.gov/library/reference/napcs/product-list/web-54189-final-reformatted-edited-us082208.pdf",
      "title": "NAPCS product list for NAICS 54189",
      "access_date": "2026-07-21",
      "what_it_supports": "The 541890 product list includes coordinating production and delivery of logoed advertising specialties and merchandise demonstrations."
    },
    {
      "id": "S3",
      "url": "https://asicentral.com/press-releases/asi-releases-2025-counselor-state-of-the-industry-promo-trends-tariffs-and-tech/",
      "title": "ASI Releases 2025 Counselor State of the Industry",
      "access_date": "2026-07-21",
      "what_it_supports": "ASI characterizes the promotional-products industry as $26.6bn and bases its State of the Industry on distributor and supplier surveys."
    },
    {
      "id": "S4",
      "url": "https://www.prnewswire.com/news-releases/asi-releases-2025-counselor-state-of-the-industry-report-promo-sales-tariffs-tech-and-market-trends-302524878.html",
      "title": "ASI 2025 Counselor State of the Industry release",
      "access_date": "2026-07-21",
      "what_it_supports": "The release reports that 50% of extra-large distributors with $5m+ sales use AI and says creative copy is the most common use among AI users."
    },
    {
      "id": "S5",
      "url": "https://investors.4imprint.com/investors/financial-highlights/",
      "title": "4imprint Financial Highlights",
      "access_date": "2026-07-21",
      "what_it_supports": "A scaled North American promotional-products distributor reported 2025 revenue, gross profit and operating profit, illustrating a viable direct-distribution model."
    },
    {
      "id": "S6",
      "url": "https://halo.com/halo-acquires-whats-happening-promotions/",
      "title": "HALO Acquires What's Happening Promotions",
      "access_date": "2026-07-21",
      "what_it_supports": "HALO announced its October 2025 acquisition of a promotional marketing agency."
    },
    {
      "id": "S7",
      "url": "https://www.prnewswire.com/news-releases/bda-acquires-harper--scott-to-bolster-creative-capabilities-and-global-network-302547478.html",
      "title": "BDA acquires Harper + Scott",
      "access_date": "2026-07-21",
      "what_it_supports": "BDA announced its September 2025 acquisition of a creative branded-merchandise agency."
    },
    {
      "id": "S8",
      "url": "https://www.overturepromotions.com/news/overture-promotions-acquires-pride-products/",
      "title": "Overture Promotions acquires Pride Products",
      "access_date": "2026-07-21",
      "what_it_supports": "Overture announced its January 2026 acquisition of a promotional-products distributor."
    },
    {
      "id": "S9",
      "url": "https://windsordrake.com/wp-content/uploads/2026/02/Windsor-Drake-EBITDA-Multiples-2026.pdf",
      "title": "Windsor Drake EBITDA Multiples by Industry, 2026",
      "access_date": "2026-07-21",
      "what_it_supports": "Its Q1 2026 observations show a 4.0x–6.5x $3m–$10m EBITDA range for marketing/digital agencies and identify retention and specialization as valuation drivers."
    }
  ],
  "dataset_inputs": {
    "labor_share": {
      "value": 0.2741,
      "method": "QCEW 2024 private total annual wages at 541890 ($4,995,994,780) x benefits multiplier 1.4294 [ECEC private-industry total comp $46.60/hr / wages $32.60/hr = 1.4294 (March 2026 reference period)] / SUSB 2022 receipts at 541890 ($19,434,299,000). Vintage mismatch: 2024 wages over 2022 receipts, stated. Level: 6-digit. Harmonized to IPS basis ÷1.3407 (median of 65 dual-method codes).",
      "sources": [
        "BLS QCEW 2024 annual averages (US000, private)",
        "BLS ECEC news release (raw/ecec.nr0.htm)",
        "Census SUSB 2022 (receipts by NAICS)"
      ],
      "year": "2024 wages / 2022 receipts",
      "quality": "MED"
    },
    "role_mix": {
      "oews_level": "4-digit 5418",
      "occupations": [
        {
          "soc": "41-3011",
          "title": "Advertising Sales Agents",
          "emp_share": 0.0952,
          "wage_share": 0.0818
        },
        {
          "soc": "27-3031",
          "title": "Public Relations Specialists",
          "emp_share": 0.0799,
          "wage_share": 0.0829
        },
        {
          "soc": "13-1161",
          "title": "Market Research Analysts and Marketing Specialists",
          "emp_share": 0.0741,
          "wage_share": 0.0655
        },
        {
          "soc": "11-1021",
          "title": "General and Operations Managers",
          "emp_share": 0.0539,
          "wage_share": 0.0926
        },
        {
          "soc": "27-1024",
          "title": "Graphic Designers",
          "emp_share": 0.0449,
          "wage_share": 0.033
        },
        {
          "soc": "41-9011",